,comment_id,comment_parent_id,comment_body,comment_link_id
288,e9hj9en,t3_9vw5qw,"Super sorry to hear about your experience.  I am a Stanford grad and can confirm that (as with any blue chip university), there are going to be some hyper-competitive a-holes and hyper-inflated egos affiliated with the school.  There is some actual merit to some of the more general comments made by this jerk—not the ones personally attacking you, but the ones about the culture of the school, the comparative academic reps of some of your other choices, etc—but my experience was that there was definitely plenty of room for many wildly different types of people at Stanford, not just this d-bag’s version of what a Stanford person looks/sounds like.  Seems like he was possibly testing (inappropriately, in my view) how “tough” you are—how you will be able to withstand criticism, being challenged, etc.  I would not pull my application per the advice of some on here—you could still get in—and as I said, this guy does not represent all of us.  

I would consider filing a complaint, however (without speculating on racial motivations—unless he said something specific, that would come across as pretty recklessly speculative.  You may indeed be right, but nothing you described of your conversation is solid evidence of that).  There is enough about the way you were treated to be upsetting to me as an alum without getting into specifics of motivation.  Others in admissions will likely feel the same way—it reflects poorly on the school and it is important to prevent this kind of toxic b.s. from becoming an accepted part of the admissions process.  

Good luck in the rest of your journey.  Hope you get in to one of the schools of your choice.  Stanford is great (and at least 20 years ago) was full of some genuinely warm, kind, funny, and brilliant people, but ultimately your success and happiness will depend 100% on what you do with wherever it is that you land.  ",t3_9vw5qw
289,e9gefby,t3_9vw5qw,"Take screen shots of this reddit forum and send it to Stanford.  They will be embarrassed this story has made it to thousands of people and reprimand him. 

Also, please take into account that any grown man who works as an academic and makes young people to feel bad has significant issues.

These academics live in a bubble- they are typically extremely weak people who cannot make it in the real world.  They will give you very nice sounding reasons why they think this is not true, but at the end of the day they are just academic looser the rest or us laugh at.",t3_9vw5qw
290,e9g83sc,t3_9vw5qw,I think he was gauging your response. That's actually a type of interview for some schools. ,t3_9vw5qw
291,e9g63iz,t3_9vw5qw,Two hours of your life you ain't getting back!  After 30 min you should have formulated an escape plan from this nonsense.  Best of luck to you.,t3_9vw5qw
292,e9h16nk,t3_9vw5qw,"So, he pretty much just challenged you and you go to reddit to cry. What is wrong with ppl these days? ",t3_9vw5qw
293,e9gcmsq,t3_9vw5qw,"I agree with him on 2 things, for physics or engineering NYU and USC aren't great schools, especially NYU. If you're doing something Physics or Engineering based, there are 20 other better schools in the USA; but you wouldn't think University of Michigan had an amazing Physics program or that Georgia Tech has some of the top engineering and computer science programs in the world. In that respect, his asshole-ism is *somewhat justified because it sounds like you haven't really done your research. 

When he asks you about what your ""thing"" is; it sounds like you're leaving out a lot of the story. What did you tell him? 

You said you want to start a company when you're older... what kind of company? You're leaving out any details about some pretty major things; which makes me think you are coloring the story in your mind and giving us half of the truth. Are you going to start a cupcake bakery? A cryptocurrency mining farm? A biotech company? It makes a big difference. If you don't really know, just ""a company""; well, no shit he responded the way he did, that's a vapid answer. I've been in school for 7 years with a B.S. in Physics and finishing my masters in CSE (stop abbreviating everything too, see how annoying it is?) and I've seen a lot of people like you; it's a lot easier to lie to yourself and paint this picture of him being an asshole when the simple truth is that you didn't live up to their expectations because you were too wooden. It's a hard school to get in to; like, old school hard to get in. They have some of the best programs and students in the entire world. You haven't mentioned anything that would get you in. If your interview with him was as lacking in details as your post about it (which I assume you had no time limit to prepare), I sort of understand. But don't let it keep you down, use it as a learning experience for other interviews or try to transfer after taking some classes somewhere else.",t3_9vw5qw
294,e9g6uil,t3_9vw5qw,College is a scam.  ,t3_9vw5qw
295,e9gddrx,t1_e9g645m,Booyah!,t3_9vw5qw
296,e9ghtck,t1_e9g645m,How does the interview program usually handle complaints like this? And how frequent are they?,t3_9vw5qw
297,e9glhwy,t1_e9g645m,This is why I love Reddit,t3_9vw5qw
298,e9glwld,t1_e9g645m,"Give him another interview, except this time with a decent human being. In my opinion though, he should take his money elsewhere. It's not like Stanford is the only good school in this country. Stanford be damned, we don't need to patronize fuck heads like this. ",t3_9vw5qw
299,e9gsz1t,t1_e9g645m,"plot twist, videsupra is the interviewer",t3_9vw5qw
300,e9h0bud,t1_e9g645m,That is both the kind of response gotham wants and also the kind it needs.,t3_9vw5qw
301,e9h8rr1,t1_e9g645m,"Sadly, this is probably very common. All bodies state, ""this type of behavior is against the core values of x"". Yet, it happens so frequently and nonchalant that it sure doesn't seem like unusual behavior. ",t3_9vw5qw
302,e9gj7gj,t1_e9g645m,Oh this is gonna be a good thread!,t3_9vw5qw
303,e9gml3p,t1_e9g645m,"OP, Look here!!! ",t3_9vw5qw
304,e9gqxzk,t1_e9g645m,this guy! I like him. ,t3_9vw5qw
305,e9hd08i,t1_e9g645m, justice boner achieved,t3_9vw5qw
306,e9hdn4v,t1_e9g645m,Hope the OP takes you up on this.,t3_9vw5qw
307,e9hhj8l,t1_e9g645m,Sounds like he had his mind made up before he started talking to the poor kid.,t3_9vw5qw
308,e9fyh89,t1_e9fxxhl,"Thank you for your advice. Appreciated.  Would you say that it is worth mentioning that I felt as if I was being stereotyped, even if it was not his intention?",t3_9vw5qw
309,e9graq5,t1_e9fxxhl,"Stanford faculty here.  I concur with writing a letter to the relevant admissions office.  I certainly don't speak for the university or my specific school, but I can't imagine our med school tolerating this level of unprofessional conduct from an interviewer.",t3_9vw5qw
310,e9gs3tr,t1_e9fxxhl,"As a faculty member at Stanford, I second this with all my heart. We work so hard to make the students feel welcome, but that work can always be endangered by any bad seed.

Please write a factual letter to admissions. They take these matters very seriously and will come back to you.",t3_9vw5qw
311,e9gdxjp,t1_e9fxxhl,"Yeah, I'd be demanding a refund. No way I'm paying to get insulted... I don't have that kind of money.",t3_9vw5qw
312,e9ggh99,t1_e9fxxhl,">For future interviews, though, do make sure that you can explain your research in great detail without notes. That is pretty important, for what it's worth.

Not just ""pretty important"", but absolutely paramount. 

u/breadwinner235 not being able to describe your research properly is an awful, awful, *awful* mistake. When I interview people who claim some kind of knowledge or experience in research, I question them at length on it precisely because a fair number of students will skate by on others' work and overstate their contribution. Questioning is how I figure out if the student has actually put the effort in or if they're pretending. When you can't coherently describe your work, you're put in the ""pretender"" camp and it weighs very heavily on you, effectively removing your experience from the list of things that you have achieved. 

I've also been in interviews where the interviewers' primary jobs were to be aggressive and to make me doubt myself, even going so far as to pretend to be offended at things I'd said. It's not easy, but they are situations you have to learn to manage tactfully. It's a legitimate interview style. Probably not for HS kids though, so you can't excuse him for that. ",t3_9vw5qw
313,e9gew7q,t1_e9fif15,I’d love to see that academic work a real job - go become a surgeon and have actual responsibilities other than just bringing in grant money (more of my fing taxes).  ,t3_9vw5qw
314,e9g97ou,t1_e9fkkub,[deleted],t3_9vw5qw
315,e9fnje8,t1_e9fl5t7,"Thanks for your advice. That’s interesting to hear about her situation. 

Also I fully agree with what you said, I’m not assuming he was being racist at all- I’m very much against assumptions.

To be clear,  it’s just what I feel it could be in hindsight. ",t3_9vw5qw
316,e9fn5oe,t1_e9fl5t7,she get into that school after the second interview?,t3_9vw5qw
317,e9g9b86,t1_e9fl5t7,"Interviewer was definitely being racist. First clue was the “you spent your life studying,” but what cemented his racism for me was when he said “you follow your parents wishes even when they’re not here” part. Asians already get so much shit, that this man had the audacity to assume OP’s behavior based on his race makes my skin crawl. I’m embarrassed at Stanford letting this man represent them. ",t3_9vw5qw
318,e9gdsx9,t1_e9fl5t7,"I agree.  If I had been in this interview, I would have seriously considered dropping the Stanford application, if this is the kind of graduate they choose to represent them to potential students.

Complaining to Stanford is a better idea. The mentioning ogling a girl at the beginning is very inappropriate as well.",t3_9vw5qw
319,e9ge9dl,t1_e9fl5t7,"I second this. Also, for him to be racist he would have to assume that his race (whatever it is) is superior to yours. Sounds like he is definitely a stereotyping asshat though. ",t3_9vw5qw
320,e9gol5p,t1_e9fl5t7,What's the difference between a racist and a raging narcissistic asshole? ,t3_9vw5qw
321,e9gelmx,t1_e9fsuk1,No kidding. It was clear he was going to follow every comment with how that was wrong. The alcohol one really proves that. Criticized for not drinking? What if there's a history of alcoholism or a medical reason? Just absurdly hostile.,t3_9vw5qw
322,e9ghrn0,t1_e9fl3di,">Your interviewer absolutely lacks basic politeness.

understatement of the century",t3_9vw5qw
323,e9gjakq,t1_e9fjyav,Disagree? ,t3_9vw5qw
324,e9gl6hs,t1_e9fl6zd,Responded to op. Thanks.  ,t3_9vw5qw
325,e9fwyeh,t1_e9fl6zd,"Lmao, when in doubt, go ask admissions mom",t3_9vw5qw
326,e9gbrj9,t1_e9fl6zd,!remindme,t3_9vw5qw
327,e9genp3,t1_e9g2ki2,*5 minutes of silence follow*,t3_9vw5qw
328,e9hdsix,t1_e9g2ki2,This whole thing reminds me of the episode where Andy interviews Dwight when he is applying to Cornell. ,t3_9vw5qw
329,e9gt6ju,t1_e9g61ks,"To say that to a HS student is absolutely ridiculous, I laughed at that part. This guy is amazing at being an asshole during interviews I guess.",t3_9vw5qw
330,e9gflvg,t1_e9g61ks,Sounds like a leading question so he could follow up by saying OP is actually awful at what he believes he excels at.,t3_9vw5qw
331,e9h0bju,t1_e9g61ks,"This is a real stereotype at Stanford. It's not true, but being surrounded by a bunch of really accomplished people can make it feel that way. ",t3_9vw5qw
332,e9h3l12,t1_e9g61ks,"Especially out of high school. And to excel at something you need to put a lot of work in but then he got upset when OP said they weren’t “drinking” and following their parents path too much and being too academic. It’s all pretty contradictory. There was no winning with this guy.
",t3_9vw5qw
333,e9ha62s,t1_e9g61ks,"This was the first thing my interviewer brought up, and I was asked the same question. Thankfully, I had a good response for it, but I agree that it’s a ridiculous question. My interviewer also wasn’t condescending (a bit arrogant maybe). Also, he showed me that he was reading from Stanford‘s list of suggested questions... ",t3_9vw5qw
334,e9gt2tj,t1_e9fk6va,Isn't that what everyone is saying?,t3_9vw5qw
335,e9h2vq1,t1_e9fp2z1,"But but but removing the bias against Asian students in academia could *indirectly help white people..*

*shudders*
",t3_9vw5qw
336,e9gm237,t1_e9gll90,"Wow, that must feel good proving that guy wrong. Well done. ",t3_9vw5qw
337,e9g93rq,t1_e9g3b6x,"to be fair, stanford does have a preponderance of this type - peter thiel, liz holmes, evan speigel, etc. ",t3_9vw5qw
338,e9gezu0,t1_e9frpyv,[deleted],t3_9vw5qw
339,e9gqkc7,t1_e9ftmwc,"We are a very diverse community. But ya know, that also means we get people from the far end of the asshole scale too :/",t3_9vw5qw
340,e9hbqg1,t1_e9ftmwc,"The part where OP needs to 'reflect on what big-shot has to say' and write it down to better his life indicates to me he's a fucking narc who has no business speaking to any decent human being.

I'm so annoyed with things like this happening -- I find it completely unacceptable to speak to others in this condescending, know-it-all manner. That attitude stinks and needs to be called out everywhere it's seen.

It really makes my blood boil.",t3_9vw5qw
341,e9hcdkc,t1_e9frcuk,As opposed to?,t3_9vw5qw
342,e9hbfo8,t1_e9fvi6e,"Harvard recently got sued for discrimination. Being biased and stereotyping Asians for being ‘boring’ for their high marks. I’m surprised this isn’t more talked about.
",t3_9vw5qw
343,e9fpgxb,t1_e9foy9c,Thank you for your advice. Really appreciate it. ,t3_9vw5qw
344,e9h8uf4,t1_e9foy9c,">Honestly I think you can spin this experience to be positive.

🤔",t3_9vw5qw
345,e9gkaql,t1_e9gjlqd,Thanks!,t3_9vw5qw
346,e9gr3ed,t1_e9g23iu,[deleted],t3_9vw5qw
347,e9g7uvm,t1_e9fqi7g,"Use your phone to secretly record your interview. If it goes like this, get the fucker fired.",t3_9vw5qw
348,e9ghqwt,t1_e9fqi7g,"Most interviews don't go like that at all and they aren't going to be a big determining factor as to whether you're admitted into a school or not. If you know how to talk about yourself and your interests, you will be fine. 

They'll take some notes, but they're not going to be there writing down stuff like: ""Took too long to answer question y"" or ""This guy stutters a lot"". They're usually normal people, except in OP's case where they had a guy projecting his own insecurities onto them.

Good luck.",t3_9vw5qw
349,e9gcnxq,t1_e9gbc84,Let me know if this is possible. Don’t feel an obligation to do so though. Thanks!,t3_9vw5qw
350,e9kj38p,t1_e9g8nmd,Why the hell would this lower his chances of getting in? The guy couldn't have done anything in his power to change what the interviewer said and Stanford shouldn't punish/lower his chances of admission if they fucked up.,t3_9vw5qw
351,e9g1j2e,t1_e9g15cw,"Don’t worry. This is an exception- all of my friends who’ve had interviews w/ Stanford or other T10s have had fun, informal and informational chats. 

If it does happen, just remember to keep some perspective and keep reflecting on the situation. If they happen to cross a line, don’t stand for it. 

Good luck!",t3_9vw5qw
352,e9hy9rc,t1_e9hgn4r,"Thanks for sharing the post but wow, that’s really nice to hear that she cares about this. If you have any updates on how that turns out, please PM me. ",t3_9vw5qw
353,e9hkkfr,t1_e9hhyj7,"Very good idea. If I decide to do so, I’ll post an update. Thanks!",t3_9vw5qw
354,e9hnk48,t1_e9g7q5d,+1,t3_9vw5qw
355,e9gqdk7,t1_e9g7q5d,As opposed to?,t3_9vw5qw
356,e9filbl,t1_e9fi9r7,"Don’t get me wrong, I 100% told him at every turn I fully disagreed, and explained why. I didn’t lose my sincerity or politeness, but assertively told him why I believed he was wrong every time. 

In hindsight it simply wasn’t worth my time. Should’ve walked out. ",t3_9vw5qw
357,e9fmeq2,t1_e9fi9r7,no   The guy was just stroking his own ego.   This is NOT what the schools want interviewers to do.,t3_9vw5qw
358,e9g0jix,t1_e9g0bm9,Alum- masters and PhD from Stanford. ,t3_9vw5qw
359,e9gbpw4,t1_e9gahef,"Although that sounds awfully serious, I don’t think it’s right for me to share his name. ",t3_9vw5qw
360,e9h1yqt,t1_e9h1ypl,"> fricking power-tripping clown. not fit for his role.


FTFY",t3_9vw5qw
361,e9h1yvk,t1_e9h1ypl,"> fricking power-tripping clown. not fit for his role.


FTFY",t3_9vw5qw
362,e9hea7h,t1_e9hcnc9,"Thanks for your reply! Though we are advised not to bring documents usually- in hindsight it would’ve been a good safety net to do so. 

Also this was an alumni interviewer, thus is volunteering his time and not working full time for the university. ",t3_9vw5qw
363,e9u3a2y,t1_e9jg0v8,I'm pretty sure it's against the subreddits policy,t3_9vw5qw
364,e9gdpmf,t1_e9gc9kr,"Honestly. ""Let's see if you let me walk us out into the shitty cold weather."" ""I wasn't paying attention to you for a for some pretty reason. Are you going to confront me about it?"" ""Defend your accomplishments because I'm telling you they're not impressive."" These seem like pretty basic tests to me.",t3_9vw5qw
365,e9gpp9b,t1_e9gcrj2,"Honestly, I don’t think he should have acted that way during the interview, but I have definitely seen this type of gatekeeping with Ivy League students (especially the alcohol one- rebelling against your parents usually comes in the form of cigarettes at Brown). There is no level high enough of gatekeeping in these universities. I feel like every year the pressure gets higher and higher and your quality of work needs to reflect that. It reminds me of how much my Ivy League interviewer was an asshole to me. There was an endless amount of sarcasm and laughter. In my opinion, those unconscious prejudices will never end in the real world, and it made me take note of every single movement I make. 

When I was friends with them they would also continue the gatekeeping comments. This is definitely anecdotal, but it just felt like every single move they had to make had to be flawless. ",t3_9vw5qw
366,e9h0k3d,t1_e9gxf3j,I agree with this. It seems like hes asking for more and challenging you to find it. The alcohol question reveals alot. Testing to see where you'd go- knowing u likely drink but are you going to admit it or say what you think people want to hear.   He likely had done many of these and sees similarities between candidates and is urging you to find an edge. ,t3_9vw5qw
367,e9h1a5n,t1_e9gxf3j,"But does he do that to everybody? If so, everyone would fail because you're applying to get into college, not a good will hunting seminar.

 I don't believe a black or white student would get roasted in that way of being a predictable academic, being asian was definitely some thing this dude was projecting like we don't need anymore factory asians here.


",t3_9vw5qw
368,e9gdwn1,t1_e9fx1s2,"That's seriously what you're judging this by? His ""virtue signaling"" and being a ""cuck?""",t3_9vw5qw
369,e9gtc4d,t1_e9fx1s2,i think you don't know what any words mean in your post,t3_9vw5qw
370,e9gc57f,t1_e9gb07u,The racism is pretty much perceived - I wouldn't say it is telling about Stanford at all. Just because one egg is rotten doesn't mean the whole batch is.,t3_9vw5qw
371,e9gq759,t1_e9gpnhv,"Thanks for this. I think the race thing is just a gut feeling and I’m open to being wrong- just the context of the spending my life studying spiel was unfounded. My gut told me it’s maybe a preconceived idea he holds, but I don’t want to victimise myself here. ",t3_9vw5qw
372,e9gjpsz,t1_e9gignn,"The failure hypothesis- I considered this but if it were the case he wouldn’t be sharing the report he sends to Stanford, with me (as he said he would). Unless he sends me a different one, which is a possibility. 

My response was one of continued respect and sincerity, and I assertively explained why I disagreed and believed him to be wrong. 

When I claimed his comments might be racially charged, it is due to the fact that he claimed I spend my life studying... without knowing or asking what I do outside of the classroom. With the lawsuit going on atm about Asians being stereotyped in such a way in admissions , I can’t help but draw a parallel. 
I’m more than open to admitting my gut may be wrong here, but I’m just expressing what I felt. ",t3_9vw5qw
373,e9gvqgb,t1_e9gignn,"Dude, this is a college interview. Every college interview I've EVER heard of has been a friendly talk to see if you're capable of handling yourself in social situations, whether you fit the character of the school, etc. I don't care if whatever elite job interviews you do use this strategy, this is literally a high schooler trying to get an education. Their job isn't to systematically break down and demean your entire character in some weird perverted test, and if that's seriously what you think high schoolers should be subjected to just to get into schools then you're not only kinda messed up but also completely wrong, because schools don't do this. I know many people that have gone through this process in elite schools, or that work in this sector and all of them would tell you this. This one guy is clearly just an egotistical brat who's not following the guidelines of what he's supposed to do. Also, in your interviews do you often brag about how cool your own projects are, or make sexual comments about female coworkers that walk by? Didn't think so.",t3_9vw5qw
374,e9hihcx,t1_e9gignn,"This is exactly right!!! This comment is exactly what happened. This is Stanford not some fucking community college,  this is how they separate the good from the great. Better luck next time. ",t3_9vw5qw
375,e9gki3k,t1_e9gjt23,"Ah okay sorry- on this subreddit I thought that most people would understand it. 
I did explain it all clearly to the interviewer about what the IB is etc. 

I do also want to say that he incited the debate about the Fed’s policies! He asked me about my economics coursework, I briefly outlined it, and he disagreed strongly.

The drinking thing I admit, although it’s a tough spot for a minor, no?",t3_9vw5qw
376,e9gcxay,t1_e9fpuev,Knowledge is next to useless if you don’t put it into practice. Unless you’re a philosopher.,t3_9vw5qw
377,e9g96w1,t1_e9g8bg7,"Yes it was all outside (outside seating for the cafe). I’m fairly sure he was, because he looked like his online profile and I didn’t receive any correspondence asking aboutnmy absence  (which would’ve happened if the real interviewer was waiting for me ). 

Thanks for the wishes.",t3_9vw5qw
378,e9g9vbe,t1_e9g91or,"Haha, I wish. I think I have to follow proper protocols for reporting him at the moment. ",t3_9vw5qw
379,e9ggvbj,t1_e9gfia3,"Don’t be, it’s a big time exception. Good luck!",t3_9vw5qw
380,e9gp9fz,t1_e9gnttp,"No, it’s done purely on availability of interviewers. ",t3_9vw5qw
381,e9hplj3,t1_e9gwbaw,"You don't inherit temper, and compulsiveness shows weakness. Get a handle on your temperament, or don't bother with a higher education. ",t3_9vw5qw
382,e9h5irr,t1_e9h5iow,"> is this guy the world's most pretentious frickhead?


FTFY",t3_9vw5qw
383,e9h5iv2,t1_e9h5iow,"> is this guy the world's most pretentious frickhead?


FTFY",t3_9vw5qw
384,e9hascn,t1_e9h9f4j,It goes away after your first post college job. Up until then it can be a difference maker for some schools and jobs. Its dumb. Lie lie lie.,t3_9vw5qw
385,e9hkpta,t1_e9hi286,"Totally understand, and I fully agree. However I think it’s important to call out this interviewer on way overstepping his boundaries. Even when i face adversity, which I know I will, if someone oversteps their boundaries I have the same duty to make sure it doesn’t happen again. ",t3_9vw5qw
386,e9pbelr,t1_e9i1ehu,You’ll be surprised but a number of dipshits get into Stanford. Even schools like Stanford. ,t3_9vw5qw
387,ebbwa12,t1_e9j490t,Not quite... Update’s up though. ,t3_9vw5qw
388,eb8wrht,t1_eb8sh5q,I find out tomorrow 4PM PST!,t3_9vw5qw
389,efxk4gn,t1_efxehjw,"No more updates after my update post (if you’ve read it). 

It would be good to look them up, for sure. Also do the basics like know what you want to talk about when it comes to your academic and extracurricular interests, and know the clubs you’d want to join/start if you went there. 

Otherwise just chill cos you won’t get someone as harsh as this guy. Best thing is to turn up relaxed and be candid with your responses. ",t3_9vw5qw
390,e9gheuy,t1_e9gfze8,"No no, that’s not the reason why I believe it may be racially motivated. 
It’s because recently theres been the huge scandal about discrimination against Asians in college admissions for being given low personality scores in admissions and being typically characterised as “boring academics”. Then, considering the point at which he’d said that to me, 10mins in, he’d only heard from me about my deep interest academically and seen what I’m like. Knew nothing about what I do outside of class (which essentially tells you if you’re just an academic)- and I do do a lot outside of class. 

I fully hate making assumptions and victimising/playing the race card. I’m not saying he definitively was stereotyping- to be clear I simply felt  that it could  most certainly be a possibility. 

I hope that’s cleared up! ",t3_9vw5qw
