,comment_id,comment_parent_id,comment_body,comment_link_id
0,e9gse2q,t3_9vw5qw,"This post is gaining a lot of traction, and given some of the posts that I've had to remove, I think it's a good time to remind everybody that the subreddit rules are still in effect. In particular, I want to point out that:

-Advising the OP to threaten or harass the interviewer directly is forbidden per rule (1) and rule (6). 

-Attempting to start discussions related to AA or race based admissions is also forbidden per rule (A) and rule (1).

Please do not be that guy who doesn't have the common sense to avoid posting stuff like this. Infractions may result in bans at my discretion.",t3_9vw5qw
1,e9g645m,t3_9vw5qw,"I just sent you a PM but wanted to pop in here to make sure you see it. I am a volunteer leader with the Stanford Alumni interview program and what you experienced is absolutely horrifying to me. It is entirely inappropriate and the antithesis of what we want our interview program to be. Check your inbox and if you're comfortable sharing, I will make sure this matters gets addressed appropriately and immediately.

Again, I am so sorry. This is not what Stanford or the Stanford community stand for in any way, shape, or form. If you're willing, I am willing to do everything in my limited power to help make this right.
",t3_9vw5qw
2,e9fxxhl,t3_9vw5qw,"I am a high-end college adviser in Los Angeles. What you experienced is absolutely inappropriate and I would recommend writing a lengthy letter to Stanford admissions describing your experience. They will definitely want to know that one of their interviewers is acting this way. Be sure to mention the ""beautiful girl"" line, specifically. That is wildly unprofessional.

If you want to take a strong, principled stand, state firmly in your letter that you are rescinding your application from Stanford and would appreciate a refund of the application fee due to this experience. 

If you do not decide to rescind your application, writing this letter well is likely to increase your admission chances, honestly. I'm sorry to hear that you had such a horrible experience :(.

edit: read some replies. I agree that the guy is just an asshole and probably not a racist. He's clearly the type that enjoys acting smarter than everyone in the room. For future interviews, though, do make sure that you can explain your research in great detail without notes. That is pretty important, for what it's worth. And although I personally disagree with the tactic, it's entirely possible that other interviews at your chosen schools will *feel* hostile and challenging. Part of what this is intended to tease out is the both the strength and grace of your intellectual spine. That said, this guy is about five steps beyond anything resembling a line.",t3_9vw5qw
3,e9fif15,t3_9vw5qw,ok what the actual fuck. please report him. ,t3_9vw5qw
4,e9fkkub,t3_9vw5qw,[deleted],t3_9vw5qw
5,e9fl5t7,t3_9vw5qw,"You should report him.  This is not normal.  Stanford will be embarrassed to know they sent this guy out there.  It won’t hurt your app chances.

I know someone who had a similar situation a couple of years ago.  The school was mortified and gave her a second interview

PS. don’t assume he was being racist, he’s probably just a raging narcissistic asshole",t3_9vw5qw
6,e9fsuk1,t3_9vw5qw,"That idiotic interviewer is definitely giving Stanford a bad name... I'm sure they would be shocked, horrified, and embarrassed to know he is out there representing Stanford so poorly. Please report him. That's not normal. Also, it seems very odd to me that he would ask you about drinking. ",t3_9vw5qw
7,e9fl3di,t3_9vw5qw,Your interviewer absolutely lacks basic politeness. Please report him for your own good and the good of every kid he will potentially interview in the future.,t3_9vw5qw
8,e9fjyav,t3_9vw5qw,[deleted],t3_9vw5qw
9,e9fl6zd,t3_9vw5qw,"u/admissionsmom

&#x200B;",t3_9vw5qw
10,e9fm9xw,t3_9vw5qw,"I'd report him tbh. Even if this is some test ur bla bla bla stuff, he had gone too far ",t3_9vw5qw
11,e9g2ki2,t3_9vw5qw,">When he came, I shook hands and he insisted we sat outside. It was freezing cold, but I obliged nonetheless. He asked quite naturally to just introduce myself and I did... but he just interrupted me and went “sorry, I didn’t catch you. I just saw a beautiful girl. Could you repeat?”. I kinda got an odd feeling from the off with this. 

This Literally reminds me of the episode of The Office when Steve Carrels interviews Darrell and reads off a wiki how to interview, and the first was to change the interview location... This is kinda pathetic LoL",t3_9vw5qw
12,e9g61ks,t3_9vw5qw,">He asked me what my ""thing"" is ... ""everyone has something they're amazing or world class at"" ...

It is absolutely baffling to me that he would even suggest this. What a narrow viewpoint on the world. You do not need to be amazing or world class at something to be a great/interesting person. ",t3_9vw5qw
13,e9fk6va,t3_9vw5qw,I don’t agree with what people here are saying—what he did was unacceptable and you should report him. ,t3_9vw5qw
14,e9fmohn,t3_9vw5qw,wtf? Please for the love of god report this man.,t3_9vw5qw
15,e9fp2z1,t3_9vw5qw,"Report. Report. Report. 

This manner of interview is unacceptable--tearing you down is not part of the process.

If you feel that any of this was racially motivated, report it. Colleges are known for discriminating against Asian applicants and do so openly. Fight back against it. Any form of racism and prejudice towards anyone, be they Asian, Caucasian, Hispanic and so on, should not be tolerated. To do that is to propagate it.",t3_9vw5qw
16,e9gll90,t3_9vw5qw,"I feel you.

It's been years, but my Harvard interview still stands out for me. Interviewer told me I shouldn't be interested in science because ""science is hard"", ""science is especially hard if you didn't go to private school"", and then asked me why a ""girl like you"" participated in sports.

So I went to MIT instead, majored in * gasp * something akin to neuroscience, and now I am an ICU doc.

Oh, and A BIG part of why I didn't return to Boston to do my ICU fellowship at Boston Children's (the Harvard children's hospital) was my memory of my interview for undergrad.

My advice: There are bad eggs associated with every otherwise reputable school. If it helps you, use the experience as fuel to show those types up. Use it as an example of what never to become regardless of how successful you are (or think you are). I doubt Stanford actually wants to associate with this guy, so I'd recommend reporting his behavior (especially the opening remarks) so they can rectify their ties with him.",t3_9vw5qw
17,e9fmzk1,t3_9vw5qw,Holy shit that’s fucked. Report him no interviewer should be that big of an asshole. ,t3_9vw5qw
18,e9g3b6x,t3_9vw5qw,"I'm a Stanford grad. I apologize for this guy's behavior. 

Please, please report this guy. He represents a small % of insecure assholes among the alumni population. Feel free to message me on how to go about reporting him without hurting your chances of admission. ",t3_9vw5qw
19,e9frpyv,t3_9vw5qw,"The best interviewers will make you feel comfortable, yet will also challenge you. He's only done one of these things, and he did it very poorly. Report him, but don't send him rude emails or anything that could reflect badly on you. ",t3_9vw5qw
20,e9fsowq,t3_9vw5qw,"Very unprofessional of him.  Who the fuck asks if you drink alcohol?  You need to report him to Stanford.  If they’re sending imbeciles like him, they really need to fix their shit.  I understand your responses though.  It’s not like you have any power in the situation, but the dude spoke in a condescending attitude the whole time, and that’s not cool no matter how smart or qualified he is.  Btw, I’m wearing a Stanford hoodie rn lmao.",t3_9vw5qw
21,e9ftmwc,t3_9vw5qw,"This man seems too high on narcissism, maybe because he thinks he is the only one who has a Phd in electrical engineering. He’s not. Stanford claims to be diverse when it comes to culture, race, and colour but this guy is obviously not following Stanford’s code of conduct. 

When i read the title of this post, i expected that this guy would apologise for the “roast” at the end of your interview and encourage you to maintain this discipline you have in your life, but oh goodness was i wrong. 

What he said is totally unacceptable and no one has a right to bash someone’s effort and lifelong determination to follow their dreams, all in 10 minutes. 
Kindly ignore all he said, it doesn’t, at all, define you and never will. See it as a reflection of his massive insecurities and nothing else. 


Please report him; not only because he’s so full of himself, but because he has no right to say all this to a young applicant like you. Do this for all the people facing racing discrimination. 

",t3_9vw5qw
22,e9frcuk,t3_9vw5qw,What the actual fuck. Cancel that bitch.,t3_9vw5qw
23,e9fvi6e,t3_9vw5qw,This guy represents everything that's wrong with the college application process. ,t3_9vw5qw
24,e9foy9c,t3_9vw5qw,"Honestly I think you can spin this experience to be positive. I can tell you’re a great writer, just email your representative for Stanford and be honest. Include how you reacted in a responsible and in-control way. The “beautiful girl” incident and racist comments will raise red flags - they will sympathize with you.  You will stand out in your application because of it ",t3_9vw5qw
25,e9g3p5p,t3_9vw5qw,"The “beautiful girl” comment and talking about alcohol is seriously unprofessional. 
Sounds like stuff I’d expect having banter with peers, not in an interview. Wtf?",t3_9vw5qw
26,e9gpmcd,t3_9vw5qw,When r/chanceme becomes a person ,t3_9vw5qw
27,e9fpfvw,t3_9vw5qw,"you should report this. this is beyond the pale and stanford would absolutely want to know that this happened and that this interviewer is out there representing their school. give as much detail as you did in your post, there is no way they would let this go on. they should give you another interview. ",t3_9vw5qw
28,e9gxnvm,t3_9vw5qw,Well congrats on the conditional acceptance. “Delete the post and you’re in”,t3_9vw5qw
29,e9h3ub1,t3_9vw5qw,"Hi. I don't know if this will be seen, but I actually work in the admissions office as an associate. Please call us and let us know that this happened. We would be happy to look into it.

We apologize for your awful experience. Our office actually doesn't really handle the interview process, but we can help pipeline the process regardless. And just know, you didn't take an L at Stanford because of this. The interview is an extremely minor aspect of the application. I want to let you know that you have no reason to be concerned about your application just because of the interview. Again, I'm really sorry you had such a traumatizing experience.

If you have any questions feel free to PM me.",t3_9vw5qw
30,e9gjlqd,t3_9vw5qw,"Hey there!

Sorry you had a bad experience in this, like others have said you should definitely submit a report (but remain professional/respectful in it).

SOMETHING TO MENTION IN YOUR REPORT. In the fall 2017, the National Association for College Admission Counseling (NACAC) new policy made it unethical to ask prospective students their schools or university preferences. The fact that your interviewer did this is incredibly unethical and shows that they have not done their due diligence in preparing for the role. This is something you should absolutely mention in your report, and feel free to PM me if you want any help in doing so. ",t3_9vw5qw
31,e9gcnhv,t3_9vw5qw,"Hi! I conduct interviews for Harvard and have had to deal with reports of similar interviewer behavior. Please don't ignore the advice on this thread to report the interviewer if you're comfortable doing so; you could harm a lot of students in future generations. Admissions boards take this kind of thing extremely seriously.

The sad truth is that interviewer training for many colleges is very poor, and certainly behind the times. In most locales, interviewers are largely not a very diverse group of people, and their views of what a good candidate is are based on what they experienced in college.

If you don't feel comfortable reporting the interviewer to the admissions committee, you could also reach out to any alum you know or have met.",t3_9vw5qw
32,e9g23iu,t3_9vw5qw,Do you really want to attend a university that hires people like you met.  The prestige is sometimes not worth it.,t3_9vw5qw
33,e9fprhr,t3_9vw5qw,I really hope you report this guy because you deserve a second chance at presenting yourself in the best light possible. ,t3_9vw5qw
34,e9g4pe2,t3_9vw5qw,"LMFAO “sorry, I didn’t catch you. I just saw a beautiful girl. Could you repeat?”

report him please please please ",t3_9vw5qw
35,e9fqi7g,t3_9vw5qw,This is literally my worst fear for my interview,t3_9vw5qw
36,e9ft0lp,t3_9vw5qw,That interviewer is so damn toxic holy. Please tell Stanford about this guy. You did not deserve this torture.,t3_9vw5qw
37,e9g1ky0,t3_9vw5qw,"Report this guy please.

This made me absolutely furious while reading the post. I've had situations as a black male where people put down my achievements and what I do simply due to my race. They say things such as ""Why do you want to do biochemistry? You won't succeed in college. You should be playing basketball or go to community college."" 

Nobody should ever need to go through open discrimination, no matter their race, and especially NOT IN A COLLEGE INTERVIEW. I really hope what this man said to you won't have any lasting feelings of doubt on your mind about what you have done in life and what you want to accomplish. Don't let the various smucks in life determine whether what you have done in life is ""good enough"" by some biased and arbitrary scale they have in their mind. 

I honestly wish you the best and hopefully Stanford gives you a 2nd interview and take that toxic guy off their list of interviewers.",t3_9vw5qw
38,e9gbc84,t3_9vw5qw,I know someone at Stanford admissions. I’ll see what I can do. This guy ain’t shit. ,t3_9vw5qw
39,e9gl5ak,t3_9vw5qw,"Wow. That sounds like a really unpleasant experience. Actually, it sounds like it sucked. I feel like you handled it the best way you could considering the circumstances.  Good on you. I’m sure you recognize that this one person isn’t representative of a whole university. There are assholes at every school. 

You might want to consider requesting another interview, and then after the application season is over send a letter to Stanford admissions detailing your experience.  

I’m sure you have some happier experiences heading your way on your admissions journey, and for now, just try to focus on how well you handled it and all the support you’ve gotten. ",t3_9vw5qw
40,e9gauip,t3_9vw5qw,"I had a very similar kind of interview 20 years ago before going to college, with another pretigious college that was not Stanford. Almost all of the comments your interviewer gave you, mine gave me, and we share a similar academic background. I'm not Asian exactly (middle eastern background, which doesn't count as Asian in the USA).

The difference between what you described and my interview was all about tone. I thought my interviewer was trying to get me to look deeper, and he wanted to approve me, but he really wanted to know why I was exceptional. He didn't badger me or belittle me or harass me. When I gave an example of my work that wasn't good enough, he just asked for another example that had more of whatever he was looking for. He definitely had concerns and definitely wasn't sure if I was good enough, even with my extensive academic background. But he was honest and polite the entire time.

So for all the people who are saying the interviewer was trying to achieve something with the way he talked to you, I can say from personal experience that I've been in THAT interview, and it doesn't sound anything like what you went through.

I'm sorry you went through this.",t3_9vw5qw
41,e9gc6z3,t3_9vw5qw,"I used to serve as a West coast interviewer for Harvard. And before people jump on me for being racist against Asians I am an Asian American myself and I pride myself for having provided a fair and even assessment on every student that has interviewed with me Asian or not.

What you just experienced was exceedingly unprofessional and exceptionally uncharacteristic of the interview process for any university that provides interviews.

Please report this immediately.  If there are enough reports that go through showing that this person is exceptionally unqualified to be interviewing students it is very possible the school will ignore a number of the interviews the interviewer has performed (if not all) and offer another interview with a college admissions officer or another interviewer (depending on when this person's behavior has been recognized and whether or not there are interviewers available in your local area that are not booked).

Unfortunately I can't really help you directly because I do not carry connections to Stanford's admissions office but again I must emphasize. Report this individual immediately. The closer to the date of this interview the better.  Make sure the report is as clear as possible.  Try to quote the individual verbatim as much as possible. Try not to infuse your own emotions into the report it will only compromise the seriousness of the message.",t3_9vw5qw
42,e9g3wcc,t3_9vw5qw,"I'm so sorry this happened to you, OP. I'm a volunteer prospective student interviewer with my alma mater (a top US university, but not Stanford, so I can't speak to their policies), and we aren't to criticize the applicants. Our job is to make them feel comfortable, explain what to expect, ask questions about their life, passions, dreams, etc. And then I write a report with my observations, generally about how driven they are, whether they're a good cultural fit for the university, if they maintained eye contact, etc. What this guy put you through is totally inappropriate. If he's behaving that way towards applicants, I'm guessing he's awful to work with in any capacity, so the university should know about it.",t3_9vw5qw
43,e9goudy,t3_9vw5qw,"I'm an interviewer for Stanford, as well. This was absolutely inappropriate, and I suggest you report him to admissions@stanford.edu. 

One thing I will say, though, is that we are told to not research you beforehand. We aren't even allowed to look at a resume that you hand us.",t3_9vw5qw
44,e9g5kup,t3_9vw5qw,"OP needs to report this ass whole in the wall.  Years ago, I had a strange interview with an Ivy League school where the direction just went off on a tangent contingent on the personal beliefs of the lead interviewer.  Basically, he decided I wasn't 'nasty or selfish enough to succeed'.  I remember being like WTF?  I should have reported this to someone.  ",t3_9vw5qw
45,e9gu3xt,t3_9vw5qw,"I've seen guys like him.  They are older and smarter than a bunch of 18 yr Olds and because they have a PhD they love to make freshmen heads roll.  It's very easy for them to come in and mentally dominate some kid straight out of high school, but they get some kick out of it because they feel like they are out smarting the future most educated people in america.  What they don't get or ignore is that ur 18!  Ur not supposed to be able to hold ur ground against a guy with a PhD on his terms, and it would incredible if u can even keep up.  Guys like him are either very bitter or very insecure and need to put smart people down to make themselves feel validated in their own intelligence, and college freshmen are ripe targets for this because they often have high intelligence but little secondary education and experience.  He was having an off day and thought he would crush someone to make himself feel better.  I dunno about the Asian thing, I think ur reading too much into it.  The working hard comment can apply to damn near any student applying to an ivy league school, unless ur parents are rich, then u just buy ur way in",t3_9vw5qw
46,e9g3jvu,t3_9vw5qw,"First, I am so sorry this happened to you. The amount of time and effort to apply to Stanford, and to be put down by some nobody is just awful. You will met narcissistic and nasty  people in your life, however, this jerk will be sending his ""observations"" to Stanford.  In some circumstances you would let this go, but not this one.  Summarize your experience, your observations, and your disappointment of lack of professionalism from the interviewer.  Ask for a second interview so you can have an opportunity to show who you are, what you stand for, and why you are a fit for Stanford. Do not be afraid to say you felt discriminated, belittled, and cut off.  Please keep us updated. I think any AO will appreciate the fact that you stood up for yourself.  Also, do not apologize in the letter for asking for a second interview.  Stick to the facts. Advise why these unfairly paint you in a bad light and left you feeling ",t3_9vw5qw
47,e9gaio0,t3_9vw5qw,"If you report him, don't make the racism claim. It'll make you seem like you're grasping. There's more than enough here to damn him already and the evidence for racism in your exchange seems pretty thin.",t3_9vw5qw
48,e9gru92,t3_9vw5qw,"Wow so this is the academics equivalent of the ""tuff love coach"" in sports? granted my education was miles from the quality you'd get at a place like Stanford but this goes beyond preparing someone from real life I mean if even that.

It's a given that there are assholes everywhere and everyone has to develop some tough skin, just I never bought the whole thing that a ton of negativity and abuse produce positive results.",t3_9vw5qw
49,e9g8nmd,t3_9vw5qw,"Hey,

For full disclosure, I am an alumni interviewer of one of the other schools you're applying to and made this throwaway to respond.

Typically, I would side with the interviewer in these cases, but when I was in your shoes many years ago, I felt like I faced a similar situation with an interviewer at a college I ended up not going to. I would say that if the interview went as you described, it is very abnormal and not representative at all of what Stanford has to offer. Now that I'm on the other side, I can recommend you some steps. Here's what I would do if I were you:

Stanford most likely uses their alumni network to do applicant interviews and there's a chair for the region where you interviewed. I would recommend you find someone who is a Stanford alum in your area, explain your situation and try to get the email address of the Alumni Interview Chair of your region. You should email the Chair, explain your situation as politely as possible, and ask if it's possible to arrange another interview with another alumni. 

Unfortunately, I think your chances of getting into Stanford will most likely be significantly diminished by this (if the interviewer gives you a low mark and you don't get another interview, your odds of getting in will drop dramatically), but it's certainly worth a shot and you may hit it off with another interviewer if given a chance. 

Cheers, and best of luck.

PS if you have any questions, you can pm me.",t3_9vw5qw
50,e9g0kob,t3_9vw5qw,what a dick head. insecure little prick who needs to pick on highschoolers to make himself feel better. don't worry about it dude.,t3_9vw5qw
51,e9g547m,t3_9vw5qw,"Honestly, he sounds like he has a personality disorder. He's that strange. Definitely report this. I doubt you'd be the only student to do so. ",t3_9vw5qw
52,e9g6nre,t3_9vw5qw,Everybody has a boss. I would take this to the Dean of Admissions and report him. Behavior like this should not be tolerated.,t3_9vw5qw
53,e9h1t6p,t3_9vw5qw,"I blew my Rice interview many years ago because the interviewer and myself had a huge personality conflict. To this day I regret not writing a formal  complaint to the university to warn them people like this are out there. 

Short version: I did a senior design project that involved research and development of a product in the biomedical field. She laughed at me and wondered what a 17 year old kid would know about any of that and thought I was just inflating my application. She recommended I go volenteer at a hospital as a candy striper. At first I thought she was just trying to provoke a response from me so I was polite but as she got more belittling I sort of lost my cool. Needless to say I didn't get in to Rice. ",t3_9vw5qw
54,e9g15cw,t3_9vw5qw,oh god I have my Stanford interview next Friday now I'm terrified,t3_9vw5qw
55,e9g4m5v,t3_9vw5qw,"Absolutely report to the admission office; they will want to know. I'm assuming this was an alumni interview, so it wouldn't hurt to report to their alumni/development/advancement office as well. ",t3_9vw5qw
56,e9g6jcl,t3_9vw5qw,"I'm heartbroken for you. You should never have been treated that way. Please report this person to Stanford. There are so many inappropriate things that happened in your interview, but I think letting them know that it started out this way says it all:

>  “sorry, I didn’t catch you. I just saw a beautiful girl. Could you repeat?”.

Respectfully ask for a second interview.",t3_9vw5qw
57,e9g6opf,t3_9vw5qw,"Hey man- I went to Stanford and I can tell you there’s a few dudes/gals who let it define them and think the place is some eden for the worthy. Honestly, it’s just full of somewhere above average intelligence people that were lucky enough to get in. Send the admissions office an email detailing your experience with no analysis or feelings to it. They’ll probably quit asking him to interview people and look at you even more closely if you come off as genuine/not whiny.

Good luck! ",t3_9vw5qw
