,comment_id,comment_parent_id,comment_body,comment_link_id
203,e9h70tg,t3_9vw5qw,"Ok I get he's an asshole,  inappropriate perhaps but if you want to flush out and get to the root of people....  Everyone writes the same nice essay.  Everyone has a 4.3. Everyone is in AP this and that.  This guy has some valid points.  He's pushing the boundaries and understands that studying isn't everything.  To be hyper successful you have to have passion for something you love.  If you work hard but are unfocused or just work hard for money you might be left a little empty. Also I think this guy was looking for the line and your backbone. Just playing devil's advocate.  Dude didnt get to decide who gets into Stanford because he's an idiot.  ",t3_9vw5qw
204,e9h7wws,t3_9vw5qw,x9 this tard plz,t3_9vw5qw
205,e9h8u6i,t3_9vw5qw,"Shame on him honestly.
You sound amazingly articulate and driven, especially for an 18 year old! 

For what it's worth, I'm deeply impressed by your recall; how you've recounted the exchange and how you kept your cool.

I know hindsight is a wonderful thing and it's so easy to kick ourselves for taking shit retrospectively but I honestly think you did yourself proud.

I've done the losing my shit with a education figure at my local uni and think I fucked my future up over it.

Felt good at the time but not so much now.

I would say that he might have realised the error of his ways afterwards and felt guilty, especially as you were so composed and written you a good report.

Be proud of yourself and don't lose heart.",t3_9vw5qw
206,e9h9f4j,t3_9vw5qw,"I don't get the american fixation with extrascholar activities, I've never been asked what I do other than studying except as small talk after the formal interview",t3_9vw5qw
207,e9h9ize,t3_9vw5qw,Sounds extreme but be prepared for anything I guess!,t3_9vw5qw
208,e9h9w3z,t3_9vw5qw,"Idk how it works in colleges in the US but in French business schools it’s a tradition to get roasted by interviewers, to see if you cope with the pressure/humiliation.
The fact you stayed till the end is a good thing IMO.",t3_9vw5qw
209,e9ha29u,t3_9vw5qw,Atleast you weren’t rude back. I definitely would have started to question the interviewer and would have lost my cool. I would for sure report the interviewer if you haven’t already ,t3_9vw5qw
210,e9ha2wg,t3_9vw5qw,"Well this is one side of the story (with many assumptions about the interviewers intent), but if this happened the way you say it did, I’m sorry for your bad time. Though the way your writing reads, it sounds more like you nervously stuttered your way through the interview while the interviewer was striding through it at 1000 miles per hour lol. Seriously though, you shouldn’t assume the interviewer was being racist. Occam’s razor dude, he probably just sucks at interviews",t3_9vw5qw
211,e9hapl4,t3_9vw5qw,this guy is full of shit,t3_9vw5qw
212,e9hb5ap,t3_9vw5qw,"This is fucking sickening -- maybe one of the biggest offenses I've ever read about from some deranged power hungry individual berating an applicant, he clearly came into the interview with the mindset of screwing around with you and kicking you to the curb.

This is disgusting behavior... 

I don't even know how to respond to shit like this -- I think you're right in thinking you should have cut the interview off short since it was clearly a bias shitshow from the get-go. Wasting 2 hours on this is an insult.. Sadly I think the power dynamic here is completely skewed (which clearly is why this kind of crap happens), complaining about it can easily be brushed off as 'well he flunked the interview of course he's mad'.

Can these things be documented on camera? At least then you have some proof that interviewers can also be the biggest A-hats in town with the little power they have.",t3_9vw5qw
213,e9hb764,t3_9vw5qw,"Wait what. I thought at the end youll be like he was kidding! Or he wanted to see my reaction! Kr he wasnt the actual interviewer!
...with? At Stanford too?",t3_9vw5qw
214,e9hbysf,t3_9vw5qw,Report this guy he can’t do that ,t3_9vw5qw
215,e9hc4y2,t3_9vw5qw," I had an interview like this with Tufts. The guy didnt want to want to meet anywhere so we finally settled for TGI Fridays. I get there and he is acting annoyed like he doesnt want to be there. I try to start conversation and he literally pulls out a sheet of paper and says give me 5 words that describe you. I do and without missing a beat he goes give me 5 traits that describe you. He was miserable and helped me realize it was not the school for me. Towards the end I was kind of over it. I asked him why he chose Tufts from out of state. He blew the question off. He asked me if Tufts was my too choice and I said I had visited but I dont think it was for me. He then asked what other schools I liked better so I was honest and told him. He scoffed and said Tufts was a better school. I said yes but not for the program I was interested in and there is more to college than just rankings. Surprisingly I ""passed"" the interview. ",t3_9vw5qw
216,e9hcjx7,t3_9vw5qw,Would have walked out of that. Could it be he was also testing your limits and perception of self-worth? As in how much more are you going to take until it's enough. ,t3_9vw5qw
217,e9hcjxc,t3_9vw5qw,"Maybe I've been on the internet too long, but who knew about this interview?  Is it even remotely possible someone set you up (and the real interviewer thinks you didn't show)?  This behavior  is so egregious that I have trouble not believing you were duped somewhere along the line.  Either as an ill-advised prank or just plain meanness. ",t3_9vw5qw
218,e9hd75u,t3_9vw5qw,"Fucking dumb elitism non sense.

""World class actor or athlete""

Lol , 99% of the Stanford students are just regular dudes with good grades that's it. Every country has these universities. But the profs think they are some high shit and turn down the best of the best for some ridiculous reasons.",t3_9vw5qw
219,e9he9d4,t3_9vw5qw,"To be fair, if you say want to start a company but haven’t, means you probably won’t anytime soon. ",t3_9vw5qw
220,e9hebh5,t3_9vw5qw,"I had a similar experience when I was applying- I had interviews for Harvard and Yale and they couldn’t have been more wildly different. 

The Harvard interviewer clearly thought he was above me and smirked when I brought out various awards (we were told to bring anything demonstrating our merit) and asked if there was anything else. Later into the conversation, he casually mentioned that there were Eastern European people who he was classmates with and called them “euro trash” -being of color myself, I was very taken aback and didn’t know what to say, and I just awkwardly nodded along and silently wondered what he must think of me if he was willing to say these things in front of a senior in high school that he had just met. Needless to say, it left a bad taste in my mouth and I was perfectly fine with it when I didn’t get in. I didn’t report him but I wish I had, he was grossly unprofessional. 

My Yale interviewer was fantastic and I’m actually still in contact with his daughter (who ended up going to the same school district as me). The experience definitely varies so don’t let this one person get you down! That was a great conversation and I still remember it with fondness. The interviewer has to respect you too, and you shouldn’t feel bad if you don’t receive that because that’s more reflective of them than it is of you. ",t3_9vw5qw
221,e9hf9qq,t3_9vw5qw,He sounds like a douchebag that harasses girls on campus. When drunk they sexually assault poor girls. Do you have his name?,t3_9vw5qw
222,e9hfd0b,t3_9vw5qw,Fuck that dude. Let's hear the podcast tho ,t3_9vw5qw
223,e9hfo5b,t3_9vw5qw,"Are you being considered for a full ride scholarship or something?  Because, otherwise: fuck Stanford, someone else will be glad to take your money.  The balls on these places, they act like they're doing you some kind of favor to take your $50k per year.",t3_9vw5qw
224,e9hg2ml,t3_9vw5qw,It sounds like you’d be an exceptional student anywhere you go and would make any university who is lucky enough to have you proud. Take your money and your talent elsewhere bro. ,t3_9vw5qw
225,e9hgopa,t3_9vw5qw,"What is ""IB"" and how old are you? Is this for a bachelor's degree straight out of high school or postgraduate?",t3_9vw5qw
226,e9hgvq9,t3_9vw5qw,"I am sorry for what you had to go through. I, as an Asian, understand how heart-breaking it is to be shamed like this, since most of us like to make our parents proud.


What he did was very unprofessional. He was clearly being a douchebag. I hope you don't take his words seriously, because everything he said was very demotivating.",t3_9vw5qw
227,e9hhgrx,t3_9vw5qw,What’s the podcast name?? Terrible situation to be in though and hope it doesn’t deter from future interviews! ,t3_9vw5qw
228,e9hhque,t3_9vw5qw,I hope he reads this and realized everyone knows he’s an asshole. ,t3_9vw5qw
229,e9hi286,t3_9vw5qw,"I don't want to defend the tactics of this interviewer as some of them appear to be quite inappropriate, however, if you don't feel ""on the spot"" or seriously challenged by an interview then I would question the point of the interview. The important thing to understand is that this is not the last time you will be challenged and will face adversity. In some cases, these interviews are designed to test your reactions and level of poise under stress. Get used to it, especially if you want to take an entrepreneurship track. ",t3_9vw5qw
230,e9hi6y0,t3_9vw5qw,"RIP, you go through the hell that is the IB Program, do well and still get shat on. One of my Dutch friends had the same with Dutch colleges with the IB as they valued their pristine dutch education system over the IBO. ",t3_9vw5qw
231,e9hjn76,t3_9vw5qw,"I had a PhD admissions interview like this once. Due to the field, I feel it was entirely a “trick” to see if I would respond directly to the inappropriateness of it. The professor was 40 years my senior and I was alone in a room with him trying to get into a program that accepts 5% of applicants. I’m not going to directly respond to your sexism sorry. ",t3_9vw5qw
232,e9hk1gr,t3_9vw5qw,This sounds like it was a “stress interview” and sounds like you did well. I had one of these at SUNY Buffalo Med school by the leader of the interview committee. It’s intentional. I got him to crack a smile once which he quickly tried to mask and regain his frown face looking stern and perturbed and unimpressed. It’s like they want to see how you respond when being grilled by an opposing lawyer. Recognize it early. Play along. Don’t give up and don’t end it prematurely. Do follow up with a short email that explains what you’re great at or are passionate about. Even if it’s written about how you love tutoring your little sister and the bond between you two. Don’t give up. PS: Cornell University has a WONDERFUL entrepreneurial environment.  ,t3_9vw5qw
233,e9hk3qn,t3_9vw5qw,https://youtu.be/OChjVLHlkVE,t3_9vw5qw
234,e9hkacr,t3_9vw5qw,He is also doing you a favor. Life after college isn't all rainbows and lollipops. You should not settle at being average. What he did was be an asshole but also helped you think about self improvement. Real life isn't as forgiving.,t3_9vw5qw
235,e9hl5ij,t3_9vw5qw,"This guy seems like such an asshole. What’s the big deal about Stanford anyways! Now that I’m working, I feel like which university you went to really isn’t that big a deal, as long as it is an acceptable one. Look at which university Buffett went to. It is all about you. Good universities are nice, but def not the only way to success. ",t3_9vw5qw
236,e9hmre2,t3_9vw5qw,"After reading over, I can’t 100% say he’s an asshole, though I seriously doubt he’s a racist. 

I’ve met men like these, many times over. And what seems to be to be the case here, he’s testing you. Discouraging you. Trying to tease out something authentic. After all, you’re essentially a stranger to him, what would he have against you otherwise? 

I can’t say for certain whether you could’ve changed the outcome of your interview. But what I can say would’ve helped you, if you had admitted to him firsthand that you drank, and when he pressed you about your drive, if you argued against him fervently. Got angry, even. That would’ve shown him you take no shit and you genuinely care about your future as an entrepreneur. Don’t modify yourself, especially for the high stakes of an interview like this. Because it’s who you are that’s going to matter the most. ",t3_9vw5qw
237,e9ho5w7,t3_9vw5qw,"Kept reading waiting for the part where the interviewer says, “okay you stood up for yourself, wanna get roasted?”",t3_9vw5qw
238,e9hr221,t3_9vw5qw,Were you interviewed by Larry David?,t3_9vw5qw
239,e9hrs7w,t3_9vw5qw,"Whoo buddy, you're better than me if you don't already have a flight of stairs in mind that you think he'd look perfect tumbling straight the fuck down.

&#x200B;

Good on you for not losing your shit, what an absolute asshat. I'm guessing any time he doesn't spend in r/gaming he spends in r/explainlikeimfive just to feel like a God. ",t3_9vw5qw
240,e9i1ehu,t3_9vw5qw,How did this dipshit get into Stanford?,t3_9vw5qw
241,e9imx7i,t3_9vw5qw,"I’m sorry this happened to you OP. You sound like a great guy with a bright future ahead of you. It sounds like you’ve learned a valuable lesson though - don’t take shit from people like that, it’s not worth it. Always treat yourself with respect. ",t3_9vw5qw
242,e9j490t,t3_9vw5qw,Please update us in December when you get accepted,t3_9vw5qw
243,e9j91ge,t3_9vw5qw,Unbelievable.,t3_9vw5qw
244,e9lzt2j,t3_9vw5qw,Hurr durr internet police xdd,t3_9vw5qw
245,e9ngvpy,t3_9vw5qw,"1/1000 times it does, more often than not it shows accurate measures of biases in the study.  Dumbass.",t3_9vw5qw
246,e9ooeb1,t3_9vw5qw,We let alumni interview? Talk about survivor bias. This is how you ruin a school’s culture.,t3_9vw5qw
247,e9w4esh,t3_9vw5qw,"Imagine being so insecure you have to belittle someone who’s not even in college. 
That guy belongs on r/iamverysmart",t3_9vw5qw
248,ea0epfb,t3_9vw5qw,What a disgusting human.,t3_9vw5qw
249,eaafssc,t3_9vw5qw,The interviewer was just a paid actor hired by “stanford”.  They got your money and now are done with you. ,t3_9vw5qw
250,eac4ool,t3_9vw5qw,The only downvotes came from the Stanford interviewer and his bot accounts. ,t3_9vw5qw
251,eaivbd3,t3_9vw5qw,!remindme 20 days,t3_9vw5qw
252,eb8sh5q,t3_9vw5qw,"I'm sorry about this. My interviewer was quite the opposite of this.

I didn't read all the comments so sorry if I am asking again, but can you please let me know if you got in or not when you find out?

I just want to know how much of an impact this a$$hole might have had on your decision, if any, since you sound like a great student. All of the things he mentioned you ""should"" be doing were kind of ridiculous, especially all of them together. Even the best student would maybe have only 1 of his supposed good-enough accomplishments.",t3_9vw5qw
253,edg04hz,t3_9vw5qw,“Stanford”,t3_9vw5qw
254,eelcmz8,t3_9vw5qw,"Report him, you shouldn't have even wasted time doing so. I feel bad for you m8, but don't get caught up in this, it's not your fault. It's their loss. Next time, try and fight back verbally, you should have civilly argued with him and any other interviewer, in school I practiced doing that with a classmate. They might want to see if you're truly passionate and stick to your beliefs. ",t3_9vw5qw
255,efxehjw,t3_9vw5qw,[deleted],t3_9vw5qw
256,e9gfze8,t3_9vw5qw,"> As I said, in hindsight his comment about me spending my life studying  was imo racially driven. In hindsight, I should’ve respectfully  terminated the interview there and then. He had no right to make such a  comment. 

Why?  Because your Asian and he is not?  You said everything he said was critical of you.  Don't assume and be that 'guy'.  It sounds like he was a jerk.  Cannot fathom why, but maybe he does every interview like this?  I would consider appealing based on his dismissive attitude. 

Never ascribe malice when incompetence provides an equally valid explanation.",t3_9vw5qw
257,e9gft88,t3_9vw5qw,"Perhaps, looking back at this interview as your future entrepreneur self, what he said to you will have been exactly what you needed to hear when you needed to hear it.

You don't need an ivy-league-esque education / environment to succeed in the endeavor of becoming your own boss- finding the harmony of self interest and professional success.  

But, then again, if you find your future self stuffed into a cubicle maze, then you can finally get past the vulgarity of the interviewer's manners and see the genius in the honesty of his message. 
",t3_9vw5qw
258,e9g694v,t3_9vw5qw,"After that, please don’t tell me you still want to go to fucking Stanford? That person should be terminated. He is driving worthy applicants away from the university. ",t3_9vw5qw
259,e9fm4wg,t3_9vw5qw,"Absolutely do not report him...yet. This sounds exactly what my dad does in interviews and it’s all a test. The fact that he’s following up with an email showing you his evaluation proves to me that he’s not entirely dismissive. He talks about what it takes to be successful, you proved it by being resilient and standing in there only to get repeatedly sucker punched. A lot of companies ask strange unsolvable questions or have different tactics for interviews and the key is always to never give up and search for an answer instead of just telling them you don’t know. I can’t promise this is what he was doing, but I’d stand pat for the time being and play the game a bit longer. Don’t be rude, but also don’t be submissive and see where it takes you. ",t3_9vw5qw
260,e9g1f68,t3_9vw5qw,I'm so sorry for you. This is totally ridiculous ,t3_9vw5qw
261,e9g1ln6,t3_9vw5qw,"You know your worth, what does this guy's opinion matter? Think about it, did you even know this guy's name before this interview? It's not like some exceptional human being was interviewing you. He was probably an insecure person that liked to feel better about himself by exploiting nervous students like you. Don't let anyone challenge your worth. ",t3_9vw5qw
262,e9gb1px,t3_9vw5qw,Am I the only one who would love to get an interview like that?,t3_9vw5qw
263,e9ggr48,t3_9vw5qw,"First, Stanford alum here. Embarrassed by this guy, he does NOT represent us. Sorry you had to go through that.

Second, I advise you to hold off on reporting him in full until AFTER you’ve gotten your acceptance decision. For now, I would simply send a short request for a second interview, and outline the most egregious behavior of his in bullet points. I would leave your feelings out of it as much as possible. You don’t want to come off as disgruntled or overly sensitive, which, rightly or wrongly, may be a factor in the admission committee’s decision.

After your decision, I would send a more detailed description, including the more racist parts of what he said (unlike others, I *do* think his comments were racially motivated). Then send it to Stanford to ensure he never interviews anyone again (you can mention your previous letter).

Good luck! ",t3_9vw5qw
264,e9g14hp,t3_9vw5qw,Damn. I thought this was some shitpost at first. Please report and let us know what happens,t3_9vw5qw
265,e9g291y,t3_9vw5qw,"I had a similar experience. I graduate next year. I’m sorry you had to go through that. He absolutely does not reflect the majority of the student population here so I encourage you not to give up on coming here!!


Also, possibly consider contacting the student service center/registrars office to report this because it’s unacceptable.",t3_9vw5qw
266,e9g7ao1,t3_9vw5qw,Somewhere on r/TIFU is a post about a guy who pretended to be a Standford admissions interviewer and said whatever he could think of to be funny,t3_9vw5qw
267,e9g8gjp,t3_9vw5qw,He sounds like a pathetic excuse for a well composed academic representer who lacks basic appropriate conversational skills. Do whatever you can do to bring his ass down. He doesn’t deserve his position. ,t3_9vw5qw
268,e9g8q4g,t3_9vw5qw,"What he did is absolutely not ok. My impression is that he felt threatened by you, a smart and driven young woman, and felt like he was in a position to put you down. Clearly insecure.

Like everyone else is saying, definitely report that guy. I wish you the best in your college search!",t3_9vw5qw
269,e9g90r4,t3_9vw5qw,Wow that's a lot of work for debt. ,t3_9vw5qw
270,e9g96u4,t3_9vw5qw,"> He responded by essentially telling me my experiment is quite simplistic, and it can’t be that long and complex. Then flexed his thesis that derived an 11th order formula

Lol, that's not even cool, you can derive an approximate formula of arbitrarily high order by using a Taylor expansion, so I don't know why he's measuring his dick based off of the ""order"" of his equation. This guy sounds like a complete twat.

Stanford should be embarrassed, you should report this asshole. This is no way to treat prospective students.",t3_9vw5qw
271,e9g9rvf,t3_9vw5qw,"This post is some of the best proof yet that ""Stanford"" doesn't exist:

https://www.reddit.com/r/ApplyingToCollege/comments/62bgi8/my_theory_stanford_doesnt_exist_let_me_explain_why/",t3_9vw5qw
272,e9gbqdc,t3_9vw5qw,u/admissionsmom,t3_9vw5qw
273,e9gby60,t3_9vw5qw,Not having to associate with people like him: you dodged a bullet.,t3_9vw5qw
274,e9gcbw7,t3_9vw5qw,"Did it really happen? I once looked up guidance for college alumni  interviewers, and I feel like this is made up because the interviewer did almost everything what not to do written there.",t3_9vw5qw
275,e9gdna6,t3_9vw5qw,I have never heard of a person that needed their teeth kicked more than this interviewer. ,t3_9vw5qw
276,e9gk0xf,t3_9vw5qw,Keep in mind that pulling the race card with no actual racism makes you a racist. ,t3_9vw5qw
277,e9gkrw9,t3_9vw5qw,Maybe it helps to call them out on their bullshit? Flex that critical thinking muscle in an assertive manner. It is in a very large a part of who of the xxxx applicants has the best ability to deal with the interviewers shittalk then and there. The obnoxiousness might all be a test,t3_9vw5qw
278,e9glepw,t3_9vw5qw,"From what you’ve just written, he sounds completely spot on with his assessment of you.",t3_9vw5qw
279,e9gpmy5,t3_9vw5qw,"I'm a bot, *bleep*, *bloop*. Someone has linked to this thread from another place on reddit:

- [/r/shitpost] [bitch please fantasy essay](https://www.reddit.com/r/shitpost/comments/9w0xfv/bitch_please_fantasy_essay/)

- [/r/stanford] [The behaviour of the interviewer this student had to deal with is disgusting.](https://www.reddit.com/r/stanford/comments/9x0a56/the_behaviour_of_the_interviewer_this_student_had/)

- [/r/u_narrow_obligation] [I got roasted in my stanford interview yesterday.](https://www.reddit.com/r/u_Narrow_Obligation/comments/aazcbq/i_got_roasted_in_my_stanford_interview_yesterday/)

&nbsp;*^(If you follow any of the above links, please respect the rules of reddit and don't vote in the other threads.) ^\([Info](/r/TotesMessenger) ^/ ^[Contact](/message/compose?to=/r/TotesMessenger))*",t3_9vw5qw
280,e9gq6sy,t3_9vw5qw,"This person was a poor representative of Stanford.  I’m sorry you went through this.

Going beyond the pure rudeness of the guy, he violated the principles of good practice when he insulted your other schools.  Many of the things you described are faux pas and shocking, but that one is actually IN WRITING by a national organization that you do not do that.",t3_9vw5qw
281,e9gqxwe,t3_9vw5qw,The interviewer is not wrong...,t3_9vw5qw
282,e9grysl,t3_9vw5qw,"I would absolutely report this guy for his behavior, whether you believe he was stereotyping or not. It was incredibly unprofessional.",t3_9vw5qw
283,e9gs23b,t3_9vw5qw,Totally report his ass. Also he seems like the type of douche to show up on r/iamverysmart,t3_9vw5qw
284,e9gs9x9,t3_9vw5qw,Sounds like a narcissistic jerk. Report him and ask for a second interview. If that’s the way he acts I’m sure this won’t be his first complaint. Good Luck,t3_9vw5qw
285,e9gt4qm,t3_9vw5qw,"Okay so I just saw this on my front page and just really needed to leave a comment. I already agree with what pretty much everyone else on this thread is saying but I also want to commend you for something you’re not getting enough credit for right now. You’re very young and still a teenager but handled that embarrassing, shitty experience like a complete champ! I’m 25 now and me at that age would have seriously broken down crying afterwards if I had to experience anything like that. 

As a fellow Asian-American(Well I’m Indian-American specifically but experiences seem fairly similar across the board), i can relate completely to dealing with the “bookish nerd” stereotype and ignorant, shitty people seriously not comprehending that we actually have passions and hobbies outside of academics. This guy who interviewed you is supposed to be a Stanford alum? He sounds like he got his education from the most stereotypical of Hollywood movies, and is also a chauvinist asshole. 

You sound like you have a bright future, my dude and any school would be very lucky to have you! ",t3_9vw5qw
286,e9h43y5,t3_9vw5qw,"Unpopular opinion: Interviewer was trying to push you to your limits. His method was unconventional, and probably inappropriate, but have thick skin. Life isnt always comfortable, so prove that you can deal with difficult situations.",t3_9vw5qw
287,e9hbofl,t3_9vw5qw,So much fake shit on Reddit right now. A question OP. Are you an incel whose father doesn’t know what to do?  Maybe you should link your two bullshit stories and form an Orion’s belt of fake karma. ,t3_9vw5qw
