,comment_id,comment_parent_id,comment_body,comment_link_id
131,e9gcrj2,t3_9vw5qw,"TBH, these are the types you'll spend the rest of your academic career with at Stanford or any Ivy and likely beyond. Either learn to deal with it or do yourself a favor and find somewhere else you fit in better.

I understand it sounds harsh, you're young, and it's probably one of the first times you've been rejected when the stakes are high. You formerly spent most of your academic career barely trying or trying way too hard, like unnaturally.

It's ok. This isn't the end of the world. There are many institutions willing to take your money, your parents.

Extremely smart people often lack social skills and grace, but good man, it goes both ways. Perception and reality, you may feel socially adept given how affronted you were however what he said wouldn't burn so much if there wasn't some truth.


",t3_9vw5qw
132,e9gq99v,t3_9vw5qw,"I've been a volunteer college interviewer for Yale for many years. I imagine that Stanford conducts interviews generally the same way. I strongly agree with other comments here encouraging you to contact Stanford/the admissions office directly with what happened, but will add that, for what it may be worth, the value of this interviewer's opinion to Stanford is probably quite low, if not entirely irrelevant. I would expect that this interviewer probably deals with all applicants in a similar way, and probably writes long, rambling, incoherent reports on applicants that the Stanford admissions office likely ignores (because of how useless they are). I think it's quite rare for interviews to actually ""hurt"" applicants, and I can imagine admissions officers at Stanford rolling their eyes whenever they see a report from this guy on students. College admissions officers know interviewers (not necessarily personally), and, at least in my opinion and experience, find certain interviewers more or less useful based on prior experiences/reports on applicants... this guy is almost undoubtedly in the ""useless"" category. At the same time, there's probably little or no incentive (at least prior to your interaction with home hopefully being reported to the admissions officers!) to remove him as an interviewer, since there are usually more applicants than people willing to interview them.

I've had students who I've written glowing recommendations for that were extremely academically qualified that did not get into Yale, and had students that I was not particularly impressed with get accepted (and matriculate). So, even presuming that I am a ""good"" or ""valuable"" interviewer, my opinion doesn't really count all that much.

(I am also fairly shocked this interview went on for 2 hours: if I, for some reason, didn't like an applicant, I would simply cut the interview short, and I can't ever recall an interview going beyond an hour and a half, even for students that I really, really liked.)

Stanford is a great school with great alumni, so, for what it's worth, please don't be discouraged by one asshole. It's not reflective on the school.",t3_9vw5qw
133,e9gtayk,t3_9vw5qw,"I would say forget about the ivy leagues and top tier universities, you will find the best educational experience in a small liberal arts institution",t3_9vw5qw
134,e9gv9mh,t3_9vw5qw,He didn’t like you and after reading your post i feel like i wouldnt want to talk with you. Then you made things worse but trying to sound smart and when he didnt come around you assume cuz he stereotyped you. Do you think this is the first asian he’s interviewed? He’s prolly married to an asian that he met there ,t3_9vw5qw
135,e9gxf3j,t3_9vw5qw,"Straight away lad. 
Hes asking you to look away from your books.
For a second. Actually think, hes not roasting you.
Hes asking you why you're so engrossed in trying to be an academic, pointing out that you are a smart guy, but you are also going through the motions and you're therefore predictable and therefore average.
Theres nothing you can do about that, because think about your next move. Your email. What are you really going to say? 
Is it predictable, are you not going to do it all? 
How will you do it, you going to rebel? 
You should lead. My advice is take his advice, and think. ",t3_9vw5qw
136,e9fx1s2,t3_9vw5qw,"HE is the reason why Stanford gets a bad rap for virtue signaling. He probably wanted to jolt you into honesty which is respectable, but from your account he seems very harsh and an all around cuck. Report him. You don't deserve that kind of disrespect, and send him an email calling him out on his bullshit. ",t3_9vw5qw
137,e9gb07u,t3_9vw5qw,"Everyone knows [Harvard is racist in their admissions](https://www.bostonglobe.com/metro/2018/08/30/justice-dept-sees-evidence-discrimination-harvard/IWkT1NmSGRapZ8WKw0shwL/story.html), but I didn't realize Stanford was too. It sounds like exactly the same thing - intentionally scoring Asians low on ""personality"" or something equally vague in order to discriminate against individuals who have otherwise perfect credentials.",t3_9vw5qw
138,e9gpnhv,t3_9vw5qw,"I’m quite conflicted. At some points he comes off as just an asshole, at some points he looks like a legitimate interviewer doing an amazing job. Thing about university is, if you’re not a complete genius, you’ll struggle at some point or another. Some of what he says looks like trying to discern how you respond under pressure. Something which you can only discern in an interview. In university you’ll be criticized, even unfairly sometimes. Or maybe you’ll think it’s unfair when it’s actually fair. Immediatly jumping to race based conclusion like you did there is ridiculous. And some of the criticism he gave you was completly fair, almost anybody who gets in your position dreams to succesfully start a company. A very small percentage of these actually manage to. Asking what makes you special in this case is completly fair. But as I mentioned, there are things there that are completly unproffesional such as the line about the girl at the begining. If that’s actually what happened, you should report him, but don’t mention the race part unless you have other evidence to back it up",t3_9vw5qw
139,e9g29lv,t3_9vw5qw,what a piece of shit update us if stanford responds to your report,t3_9vw5qw
140,e9g2nbt,t3_9vw5qw,I hope you report his ASSHOLE,t3_9vw5qw
141,e9g5h7i,t3_9vw5qw,VAC ban the guy,t3_9vw5qw
142,e9gekdj,t3_9vw5qw,That is crazy!! Sorry you had to go through that. I am low key sensitive and would have been contemplating my life if that was my interview and top choice.,t3_9vw5qw
143,e9gjvzg,t3_9vw5qw,"It’s weird I feel like this is kind of how management consulting firms interview - it’s all about seeing how one handles stress elements and curveballs, presentation and conciseness.  And well hate to say it but it actually is an important skill as I’ve had some pretty intense managers and even more intense clients.  Anyway not going to say right or wrong but to me it just felt like “real world” and how you handle it.  Maybe he wanted you to push back and identify him as racist, anyways I’m not going to pretend I know his thoughts anymore.",t3_9vw5qw
144,e9gro4w,t3_9vw5qw,"Harvard has been known to be racist as well. In fact, the (left leaning) college system seems to dock Asian people for being Asian",t3_9vw5qw
145,e9gz7dr,t3_9vw5qw,"So you failed an interview and now you are complaining about the interviewers techniques and methods? 

His job is to weed out the characters he doesn't think would fit in and it sounds like he said all the right things to make you tick and watched how you reacted.

And if this is how bitter you are about it in Reddit, I'm betting you were a dick to him in the interview also, and that part you leave out.

Remember folks, two sides to a story.",t3_9vw5qw
146,e9gzxew,t3_9vw5qw,"I don’t feel like he was being racist at all. Jumping to a conclusion like that will not help your chances and can only be viewed as problematic, just tell them the facts. What he said, when he said it, what you said, when you said it. Report him for sure. ",t3_9vw5qw
147,e9gignn,t3_9vw5qw,"It’s fairly obvious he was testing how you would respond to failure. (It should be obvious because of how he responded to when you mentioned Harvard). He puts you under pressure, and tells you that everything you’ve ever done is worthless to see how you react. Do you lack self-confidence and become flustered? Do you lose your temper? Or do you stand by your achievements? 

Your logic for coming to the conclusion that he was racially-biased is flawed, as well. Stanford has a large overrepresentation of Asians, and your only “evidence” for believing he was biased was that he was talking about your studying? In a school admissions interview? 

Anyways, clearly you failed if this is how you respond. As someone with experience performing this kind of interview (not school admissions, but same methodology), my advice to you is don’t ever believe you deserve anything. Your history doesn’t matter, what you’ve done, what you’ve worked for doesn’t matter. Just because you have experience doesn’t mean someone else doesn’t have even more potential. Focus on your aspirations and outline how you will achieve your goals.",t3_9vw5qw
148,e9gjt23,t3_9vw5qw,"He sounds like a douche. That said, you need to work on your communication skills. For one thing, you mentioned many things out of nowhere as if everybody knows what they mean. Perhaps this is why he said you made no sense.

What is “my IB”? What does it mean to be “predicted an A”? You get a grade before a grade? Several times you mention terms with no context and expect your audience to know what that is - is it possible you were doing the same with the interviewer? He was an electrical engineer and you debated him on the financial policies of the fed. You told him you don’t drink and then that you do.

You’re communication needs work. Of course, this guy was also just a total asshole. ",t3_9vw5qw
149,e9fpuev,t3_9vw5qw,"Honestly speaking, you shouldn't have taken shit from him. Spending your life studying does not mean you have no skills, it just means that you may not have had time to explore them but in your case, that doesn't seem to be the issue.

If it happened to me, I'd be sure to remind him that if someone like him can get into Stanford then you have a pretty solid chance to get in too",t3_9vw5qw
150,e9gv0b6,t3_9vw5qw,"Who cares, snowflake? Life is tough, it will only get tougher. Stanford is an elite school, he was right to have strict standards. They truly are looking for more than just “good students”. They are looking for the next billionaire donor. They wont get that from someone who is like every other try hard student.

Instead of coming onto reddit to bad mouth some stranger who gave you more truth than youll get from anyone else for the rest of your life, why not look for the truth in it instead of validation from other strangers?",t3_9vw5qw
151,e9g8bg7,t3_9vw5qw,"Was the whole interview outside? Are you *SURE* that he was your official interviewer? This sounds extremely questionable. 

I’m wondering if the *real* interviewer was sitting in a conference room somewhere wondering why OP never showed. Either that or the real interviewer was sick and this dude was a substitute.

So weird. Best wishes for your future OP",t3_9vw5qw
152,e9g91or,t3_9vw5qw,"name and shame
name and shame
name and shame",t3_9vw5qw
153,e9gfia3,t3_9vw5qw,"Jeez man, that’s really unfair. I have my stanford interview next week and now I’m even more nervous lol.",t3_9vw5qw
154,e9gfiac,t3_9vw5qw,You lucky bastard,t3_9vw5qw
155,e9gfwxn,t3_9vw5qw,"Well I can tell you're going to do great in life! So don't worry about some ""random"" encounter.

The interviewer must be insufferable to be around.",t3_9vw5qw
156,e9ggx9t,t3_9vw5qw,"I’m very sorry you had to deal with that, best of luck with the rest of your application process! Just wanted to add that I think Cornell is a great place if you end up seriously considering it, I just started my freshman year ",t3_9vw5qw
157,e9gnttp,t3_9vw5qw,"sorry to hear about your experience, but I'm very confused. I did stanford REA as well (which I'm assuming u did) but I didn't get any interview offer.

did i screw something up :/",t3_9vw5qw
158,e9gtwz4,t3_9vw5qw,"In a movie world, emailing him a hate letter saying that his criticisms were founded upon BS argumentation and that he had nothing of value for YOU to learn from meeting. That his ignorance and his unprofessional attitude and behavior towards you during your discussion is what will drive to you become a successful person who plans to best him and encourage all to abstain from degrading others as he has you, would earn his respect and he’d find you as “differentiated”. But one can only theorize...",t3_9vw5qw
159,e9gu7ww,t3_9vw5qw,"Report him. He's pretty creepy too. See if you can talk to him. Record the conversation by starting off with "" why did you say what you said yesterday"" and stuff like that. Not super obvious but I doubt someone like that would notice and think someone he critized would be smart enough to catch him in the act of being a horrible person. This might not be legal in some states but if you want to go the extreme, check your laws on recording audio first ",t3_9vw5qw
160,e9gv5tr,t3_9vw5qw,what a dick,t3_9vw5qw
161,e9gv7bi,t3_9vw5qw,"Kinda off topic but I already earlied to Stanford, should I be expecting an interview or is it only in certain cases?",t3_9vw5qw
162,e9gvpjb,t3_9vw5qw,"I’m sorry about your shitty interview. 
I interviewed for a lot of ivies and Stanford and most of my interviews went well (except MIT and Cornell)

Really the interview can’t affect your status of getting into the school, it’s mostly a chance for you to ask questions about the school or add to the list

I’m very sorry you got a bad interviewer. I had heard horror stories of interviewers asking hard/pressing questions. Sadly, depending on where you love the choice of who interviews you can small.

Good luck with your college applications, I’m sure you’ll do great. You sound much more talented than I ever was. ",t3_9vw5qw
163,e9gw3yc,t3_9vw5qw,He probably hasn't gotten laid for a while. Don't take it personally man fuck that douche bag.,t3_9vw5qw
164,e9gwbaw,t3_9vw5qw,"TBH as an Asian American girl who has been racially stereotyped, I would be so enraged, so I feel your pain. Since I'm EXTREMELY compulsive and inherited my mother's temper, I would most definitely have stood up and said (and as I was reading this, I was literally reciting in my head),

""Excuse me, would you be as kind to shut your mouth so I can say something before I end this interview. I don't care that you published whatever 11th order paper or that you graduated from Stanford, who are you to belittle me and disrespect all of the things that shaped me into who I am. Frankly, if this is what Stanford Alumni are like: pretentious and emotionally exhausting to be around, I've made my decision that I DON'T want to go to Stanford. Thank you for showing me what kind of people this university produces and saving my time and energy for not dwelling on whether Ill get an acceptance letter later. I think we're done here SIR""",t3_9vw5qw
165,e9gx4lz,t3_9vw5qw,!remindme 5 days,t3_9vw5qw
166,e9gxerw,t3_9vw5qw,"Don't listen to this chode of a conjuration made up of sadness and despair. With people like that, it doesn't matter what you say, he would always oppose it. Most of the time those people end it with ""oh I just wanted to be a hardass to see how you would do"", and I'm surprised he actually felt this way about you. Understand that you don't need to naturally know how to play an instrument or be first in the fair. None of that should matter. What matters is your strive to learn that instrument or have the self appreciation to enter the competition in the first place. That's what matters and if he, a representative of the university, doesn't recognize that, then you don't want to go there anyways ",t3_9vw5qw
167,e9gxlr8,t3_9vw5qw,"Things you could do: 

- Tell him you're going to record the interview.
- Tell him thanks, but no, you're going to seek an interview with someone else.",t3_9vw5qw
168,e9gxu9v,t3_9vw5qw,"Hone your instincts about people and know when you’re being judged outside of merit. If you can learn this it will protect you from these sneaky types of abuse. You gave this person the satisfaction of tearing you down for 2 hours. That was not his job but that was his tactic. Why did he do it? Who’s to say really, but know and understand how it made you feel and realize that you never need that. If you weren’t a fit so be it, If somehow he meant to push you to be greater then the kind of blunt criticism you described was a shit tactic to push an aspiring youth. It sounded like this guy was smart but he wasn’t smart enough to be kind. You might be the prospective student with much to learn but that guy, that guy hasn’t learned basic decency, so fuck what he knows. I learned a long time ago that in these types of settings it’s best to not give a shit about people clearly not giving a shit about me because doing so will make me the lesser in an environment that was meant to be evaluative instead of combative. You’re there to see if you can make the cut not to get crapped on.",t3_9vw5qw
169,e9gy79l,t3_9vw5qw,"Damn, that sounds extremely harsh. If there's anyone you can report this to, do it. You don't need to take any shit, especially not unprofessional shit.",t3_9vw5qw
170,e9gyatk,t3_9vw5qw,My brother said he had a similarly weird experience with Stanford interviewers ,t3_9vw5qw
171,e9gydrv,t3_9vw5qw,"Serious question: Are you sure this guy was a legit interviewer? 

A few of the details (i.e. not sitting inside, outlandish comments, not making any salient points about any academic subjects discussed)  you've mentioned are pretty consistent with someone who recognized you were probably a propsective student there for an interview and took advantage of it to fuck with you. Would't have been difficult to deduce you were a prospective student there for an interview if a lot of people were interviewing that day as well. 

Did he know who you were/was expecting you by name or anything else to suggest he wasn't just acting the part?",t3_9vw5qw
172,e9gyguj,t3_9vw5qw,"I thrive to be this level of asshole one day.

It's just an interview man. Wait till the real world, when everyone is gonna be an asshole. You got worked up by an interview? He probably doesn't want thin skinned people like you who only resort to calling racism instead of looking inside.",t3_9vw5qw
173,e9gz91p,t3_9vw5qw,What a douche,t3_9vw5qw
174,e9gzb3m,t3_9vw5qw,I thought that at the end of all this you were going to say that he was just pulling your leg this entire time and he told you that you're exactly the kind of individual Stanford needs. Really lame this turned out to be a real interview. ,t3_9vw5qw
175,e9gzihq,t3_9vw5qw,"Should have just told him that admitting to drinking underage can be pursued as a infraction and people with a criminal record are not treated well by the admissions board very well. My god even in job interviews, when asked have you ever drunk, your answer is either a social drinker or no not at all as it's not professionally relevant nor would it be for contributing to a bright entrepenurial community",t3_9vw5qw
176,e9h004s,t3_9vw5qw,.,t3_9vw5qw
177,e9h035h,t3_9vw5qw,"This might be an unpopular opinion, but if your recollection of that conversation is accurately described, there might be an underlying reason for how he acted. The first flag was the immediate “didn’t catch that” comment. Even the biggest assholes don’t usually start off with something like that. That’s just not normal behavior for any type of interview regardless of whether the person is a dick or not. Unless, however, there was a reason for it.

You might have done excellent in the interview. But the point that he clearly undermined everything you said and made harsh accusations seems like a flag. Some interviewers in the real world (I say that because you’re 18, no offense) like to see how the candidate will handle difficult situations and difficult people. Instead of just answering simple predetermined questions in a monotonous way, you can much easily gauge someone’s personality by how they react to a situation. In this case, that situation would clearly be a shitbag as an interviewer. That might be his way of interviewing to see how students react. Stanford Im sure is a very tough school (which I know nothing about) with a very stress-heavy academic calendar. Students who break over someone who is just an asshole to them might not make the cut. They might be looking for people with a thicker skin. 

I think it was great that you held your own and didn’t break character and unleash on this guy. Even if I’m entirely wrong and he is just a shitbag, you still took the high road and didn’t drop to his level. If I’m right, you looked fantastic in the interview.

Anyways, just my two cents on that. 

",t3_9vw5qw
178,e9h070a,t3_9vw5qw,ive been through an alternate version of this with a sexist interview and i lost my job over it and i came to the same conclusions. there was no reason to be polite ill never get caught like that again. ,t3_9vw5qw
179,e9h07tq,t3_9vw5qw,Lesson learned. Don't take shit (unless you deserve it or the person giving it has earned the right to give it... but this guy was a douche). ,t3_9vw5qw
180,e9h09pu,t3_9vw5qw,Sounds like he was playing with your head if you ask me. It was the interview. He was looking for resilience.,t3_9vw5qw
181,e9h0d12,t3_9vw5qw,"I can barely remember any of the applying-for-college process or whatnot at this point, and frankly it wasn't even a significant part of my life.. but holy fuckin' hell. What a dickweed.

Nothing annoys me more than that vibe of asking a question then immediately pissing all over it no matter the answer, and you can really tell. The person wasn't wanting to have a conversation or an interview, it was basically egotistical masturbation.",t3_9vw5qw
182,e9h0ibn,t3_9vw5qw,"When he told you to take notes on what he said you shouldve written ""you're a cunt"" torn the page out and given it to him",t3_9vw5qw
183,e9h0ln0,t3_9vw5qw,Ouch dude. That sucks.,t3_9vw5qw
184,e9h0zo4,t3_9vw5qw,"Hey probably won’t see this but having done a few interviews in my life and been on both sides the interviewer and interviewee. This happens some Times they want to see how you handle rejection, and conflict if you did as you said they should phone you back and offer you a place ",t3_9vw5qw
185,e9h1j81,t3_9vw5qw,Are those exact quotes from the interviewer or just how the words he said made you feel? I'm guessing it is the latter.,t3_9vw5qw
186,e9h1ouc,t3_9vw5qw,[removed],t3_9vw5qw
187,e9h24pc,t3_9vw5qw,Sounds like a real life Terrence Fletcher,t3_9vw5qw
188,e9h29g7,t3_9vw5qw,This pisses me off abuse of power is not right. Report him ,t3_9vw5qw
189,e9h2c2n,t3_9vw5qw,">beautiful girl

Yeah contact the uni about it",t3_9vw5qw
190,e9h33d7,t3_9vw5qw,Sorry to hear that you had such a terrible experience. And yeah you're absolutely right about walking out of the interview. No one is eligible/ entitled to talk to anyone in such a rude fashion. Just want to wish you good luck with your future! ,t3_9vw5qw
191,e9h4iu2,t3_9vw5qw,Why would you want to goto a University that let people like this person handle admissions? ,t3_9vw5qw
192,e9h4jcw,t3_9vw5qw,"i’ve had a pair of twins from my high school that both got accepted into stanford. most interesting thing about them? that they were twins, that’s it.  ",t3_9vw5qw
193,e9h4wtv,t3_9vw5qw,Ask me how I know your interviewer was a Jew.,t3_9vw5qw
194,e9h5a2b,t3_9vw5qw,This happened to me with a Devry recruit.,t3_9vw5qw
195,e9h5fx0,t3_9vw5qw,"Girl, I'm sorry you had to go through that. I have an interview with Princeton in like 4 hours and I can't imagine how I'd feel if it went like that. I hope everything goes well. You've received awesome advice as I saw in the comments.",t3_9vw5qw
196,e9h5iow,t3_9vw5qw,Is this guy the world's most pretentious fuckhead?,t3_9vw5qw
197,e9h5o4b,t3_9vw5qw,"How did you not loose your temper with him, I’d have definitely thrown my crayons at him. Then again that’s probably why I couldn’t do university 😉 ",t3_9vw5qw
198,e9h5uh4,t3_9vw5qw,"I was attracted by your narrative in the beginning, then found that consensus because of IB (and monetary policy, ofc), and felt bad for you in the end. Report him!",t3_9vw5qw
199,e9h5vwk,t3_9vw5qw,He's a dumb dumb.  You will get into other schools I am sure.,t3_9vw5qw
200,e9h5z2p,t3_9vw5qw,"I’m so damn sorry you went through this. You don’t deserve to be mistreated at any interview. File a complaint, and look elsewhere for a university that has better and more kind faculty. 

(Edit: I go to a so-called elite university... been to non-elite and always had a much better experience. Go where the good people are, not where the rep is. Just my experience and opinion.)",t3_9vw5qw
201,e9h67mm,t3_9vw5qw,NJ,t3_9vw5qw
202,e9h6gus,t3_9vw5qw,I'm 75% sure this guy was on cocaine,t3_9vw5qw
